{
  "$schema": "https://json-schema.org/draft/2020-12/schema",
  "$id": "https://raw.githubusercontent.com/klokast/klokast-box/main/schemas/klokast-instance-v1.schema.json",
  "$defs": {
    "id": {
      "type": "string",
      "pattern": "^[a-z0-9](?:[a-z0-9-]{0,61}[a-z0-9])?$"
    },
    "app-id": {
      "$ref": "#/$defs/id",
      "description": "Application name. The names platform, doctor and air are reserved for kk commands.",
      "not": {
        "enum": [
          "platform",
          "doctor",
          "air"
        ]
      }
    },
    "box-id": {
      "type": "string",
      "pattern": "^[a-z](?:[a-z0-9-]{0,61}[a-z0-9])?$"
    },
    "tailnet-dns-name": {
      "type": "string",
      "pattern": "^[a-z0-9](?:[a-z0-9-]*\\.)+ts\\.net$"
    },
    "login": {
      "type": "string",
      "pattern": "^[^@\\s]+@[^@\\s]+\\.[^@\\s]+$",
      "maxLength": 320
    },
    "member": {
      "type": "object",
      "additionalProperties": false,
      "required": [
        "roles"
      ],
      "properties": {
        "roles": {
          "type": "array",
          "minItems": 1,
          "uniqueItems": true,
          "items": {
            "enum": [
              "family",
              "operator"
            ]
          }
        }
      }
    },
    "box": {
      "type": "object",
      "additionalProperties": false,
      "required": [
        "site",
        "country",
        "description",
        "connectivity",
        "routing-profile"
      ],
      "properties": {
        "substrate": {
          "$ref": "#/$defs/substrate"
        },
        "site": {
          "$ref": "#/$defs/id"
        },
        "country": {
          "type": "string",
          "pattern": "^[A-Z]{2}$"
        },
        "description": {
          "type": "string",
          "maxLength": 500
        },
        "connectivity": {
          "type": "array",
          "minItems": 1,
          "uniqueItems": true,
          "items": {
            "enum": [
              "overlay",
              "local-ap-uplink",
              "direct-wan-egress",
              "edge-tunnel-ingress",
              "direct-wan-ingress",
              "vpn-wan-egress"
            ]
          }
        },
        "vpn-egress": {
          "type": "object",
          "additionalProperties": false,
          "required": [
            "clients"
          ],
          "properties": {
            "subscription-ref": {
              "type": "string",
              "pattern": "^[a-z][a-z0-9-]{0,62}$"
            },
            "clients": {
              "type": "array",
              "uniqueItems": true,
              "items": {
                "type": "string",
                "pattern": "^[a-z0-9][a-z0-9-]{0,62}$"
              }
            }
          }
        },
        "routing-profile": {
          "$ref": "#/$defs/routing-profile"
        }
      }
    },
    "ipv4-address": {
      "type": "string",
      "pattern": "^[0-9]{1,3}(?:\\.[0-9]{1,3}){3}$"
    },
    "device-binding": {
      "type": "object",
      "additionalProperties": false,
      "required": [
        "hostname",
        "ipv4-address",
        "mac"
      ],
      "properties": {
        "hostname": {
          "$ref": "#/$defs/id"
        },
        "ipv4-address": {
          "$ref": "#/$defs/ipv4-address"
        },
        "mac": {
          "type": "string",
          "pattern": "^(?:[0-9a-fA-F]{2}:){5}[0-9a-fA-F]{2}$"
        }
      }
    },
    "substrate": {
      "type": "object",
      "additionalProperties": false,
      "properties": {
        "bridge-ports": {
          "type": "object",
          "propertyNames": {
            "enum": [
              "bak",
              "backend",
              "dmz",
              "iot",
              "usr",
              "wan",
              "lan",
              "household",
              "admin",
              "ap-uplink"
            ]
          },
          "additionalProperties": {
            "type": "array",
            "minItems": 1,
            "uniqueItems": true,
            "items": {
              "type": "string",
              "pattern": "^[A-Za-z0-9_.:-]{1,32}$"
            }
          }
        },
        "dhcp-reservations": {
          "type": "array",
          "items": {
            "$ref": "#/$defs/device-binding"
          }
        },
        "shared-guests": {
          "type": "object",
          "propertyNames": {
            "enum": [
              "bak",
              "dmz",
              "iot"
            ]
          },
          "additionalProperties": {
            "type": "object",
            "additionalProperties": false,
            "properties": {
              "runtime-state": {
                "enum": [
                  "running",
                  "stopped"
                ]
              }
            }
          }
        }
      }
    },
    "inactive-placement": {
      "type": "object",
      "additionalProperties": false,
      "properties": {
        "primary": {
          "$ref": "#/$defs/inactive-box-target"
        },
        "secondary": {
          "$ref": "#/$defs/inactive-box-target"
        },
        "builder": {
          "$ref": "#/$defs/inactive-box-target"
        },
        "boxes": {
          "type": "array",
          "uniqueItems": true,
          "items": {
            "$ref": "#/$defs/box-id"
          }
        }
      }
    },
    "inactive-box-target": {
      "oneOf": [
        {
          "$ref": "#/$defs/box-id"
        },
        {
          "const": ""
        }
      ]
    },
    "inactive-user": {
      "type": "object",
      "additionalProperties": false,
      "required": [
        "slug",
        "tailscale-login",
        "vm-ipv4-address"
      ],
      "properties": {
        "slug": {
          "$ref": "#/$defs/id"
        },
        "system-user": {
          "type": "string",
          "pattern": "^[a-z_][a-z0-9_-]{0,31}$"
        },
        "tailscale-login": {
          "$ref": "#/$defs/login"
        },
        "vm-ipv4-address": {
          "$ref": "#/$defs/ipv4-address"
        }
      }
    },
    "inactive-app": {
      "type": "object",
      "additionalProperties": false,
      "properties": {
        "placement": {
          "$ref": "#/$defs/inactive-placement"
        },
        "resources": {
          "type": "object",
          "propertyNames": {
            "$ref": "#/$defs/id"
          },
          "additionalProperties": {
            "type": "boolean"
          }
        },
        "runtime-state": {
          "enum": [
            "running",
            "stopped"
          ]
        },
        "ingress-mode": {
          "type": "string",
          "pattern": "^[a-z][a-z0-9_-]{0,127}$"
        },
        "isolation": {
          "type": "string",
          "pattern": "^[a-z][a-z0-9_-]{0,127}$"
        },
        "devices": {
          "type": "object",
          "propertyNames": {
            "$ref": "#/$defs/id"
          },
          "additionalProperties": {
            "type": "object",
            "propertyNames": {
              "$ref": "#/$defs/box-id"
            },
            "additionalProperties": {
              "$ref": "#/$defs/device-binding"
            }
          }
        },
        "app-vms": {
          "type": "object",
          "propertyNames": {
            "$ref": "#/$defs/id"
          },
          "additionalProperties": {
            "type": "object",
            "propertyNames": {
              "$ref": "#/$defs/box-id"
            },
            "additionalProperties": {
              "type": "object",
              "additionalProperties": false,
              "required": [
                "vm-ipv4-address"
              ],
              "properties": {
                "vm-ipv4-address": {
                  "$ref": "#/$defs/ipv4-address"
                }
              }
            }
          }
        },
        "users": {
          "type": "array",
          "items": {
            "$ref": "#/$defs/inactive-user"
          }
        },
        "ephemeral": {
          "type": "object",
          "additionalProperties": false,
          "properties": {
            "privileged-approval": {
              "type": "boolean"
            },
            "cleanup-required": {
              "type": "boolean"
            },
            "expires-at": {
              "type": "string",
              "pattern": "^(?:|[0-9]{4}-[0-9]{2}-[0-9]{2}T[0-9]{2}:[0-9]{2}:[0-9]{2}Z)$"
            }
          }
        }
      }
    },
    "single-box-placement": {
      "type": "object",
      "additionalProperties": false,
      "required": [
        "mode",
        "box"
      ],
      "properties": {
        "mode": {
          "const": "single-box"
        },
        "box": {
          "$ref": "#/$defs/box-id"
        }
      }
    },
    "active-passive-placement": {
      "type": "object",
      "additionalProperties": false,
      "required": [
        "mode",
        "active",
        "passive"
      ],
      "properties": {
        "mode": {
          "const": "active-passive"
        },
        "active": {
          "$ref": "#/$defs/box-id"
        },
        "passive": {
          "$ref": "#/$defs/box-id"
        }
      }
    },
    "multi-box-placement": {
      "type": "object",
      "additionalProperties": false,
      "required": [
        "mode",
        "boxes"
      ],
      "properties": {
        "mode": {
          "const": "multi-box"
        },
        "boxes": {
          "type": "array",
          "minItems": 1,
          "uniqueItems": true,
          "items": {
            "$ref": "#/$defs/box-id"
          }
        }
      }
    },
    "data": {
      "type": "object",
      "additionalProperties": false,
      "required": [
        "box",
        "retention"
      ],
      "properties": {
        "box": {
          "$ref": "#/$defs/box-id"
        },
        "retention": {
          "const": "preserve"
        }
      }
    },
    "app": {
      "type": "object",
      "additionalProperties": false,
      "required": [
        "desired-state"
      ],
      "properties": {
        "desired-state": {
          "enum": [
            "present",
            "absent"
          ]
        },
        "placement": {
          "oneOf": [
            {
              "$ref": "#/$defs/single-box-placement"
            },
            {
              "$ref": "#/$defs/active-passive-placement"
            },
            {
              "$ref": "#/$defs/multi-box-placement"
            }
          ]
        },
        "features": {
          "type": "object",
          "propertyNames": {
            "$ref": "#/$defs/id"
          },
          "additionalProperties": {
            "oneOf": [
              {
                "type": "boolean"
              },
              {
                "type": "string"
              }
            ]
          }
        },
        "data": {
          "type": "object",
          "propertyNames": {
            "$ref": "#/$defs/id"
          },
          "additionalProperties": {
            "$ref": "#/$defs/data"
          }
        }
      },
      "allOf": [
        {
          "if": {
            "properties": {
              "desired-state": {
                "const": "present"
              }
            }
          },
          "then": {
            "required": [
              "placement"
            ]
          }
        },
        {
          "if": {
            "properties": {
              "desired-state": {
                "const": "absent"
              }
            }
          },
          "then": {
            "required": [
              "data"
            ],
            "properties": {
              "data": {
                "minProperties": 1
              }
            },
            "not": {
              "anyOf": [
                {
                  "required": [
                    "placement"
                  ]
                },
                {
                  "required": [
                    "features"
                  ]
                }
              ]
            }
          }
        }
      ]
    },
    "routing-profile": {
      "type": "object",
      "additionalProperties": false,
      "required": [
        "domain-list-url",
        "bootstrap-dns",
        "vpn-dns"
      ],
      "properties": {
        "domain-list-url": {
          "type": [
            "string",
            "null"
          ],
          "maxLength": 2048
        },
        "bootstrap-dns": {
          "type": "array",
          "minItems": 2,
          "maxItems": 2,
          "uniqueItems": true,
          "items": {
            "$ref": "#/$defs/ipv4-address"
          }
        },
        "vpn-dns": {
          "type": "array",
          "minItems": 2,
          "maxItems": 2,
          "uniqueItems": true,
          "items": {
            "type": "string",
            "maxLength": 2048
          }
        }
      }
    }
  },
  "type": "object",
  "additionalProperties": false,
  "required": [
    "$schema",
    "schema-version",
    "tailscale",
    "boxes",
    "controllers",
    "airunners",
    "apps"
  ],
  "properties": {
    "inactive-apps": {
      "type": "object",
      "propertyNames": {
        "$ref": "#/$defs/app-id"
      },
      "additionalProperties": {
        "$ref": "#/$defs/inactive-app"
      }
    },
    "$schema": {
      "type": "string",
      "format": "uri"
    },
    "schema-version": {
      "const": 1
    },
    "tailscale": {
      "type": "object",
      "additionalProperties": false,
      "required": [
        "tailnet-dns-name",
        "members"
      ],
      "properties": {
        "tailnet-dns-name": {
          "$ref": "#/$defs/tailnet-dns-name"
        },
        "members": {
          "type": "object",
          "minProperties": 1,
          "propertyNames": {
            "$ref": "#/$defs/login"
          },
          "additionalProperties": {
            "$ref": "#/$defs/member"
          }
        }
      }
    },
    "boxes": {
      "type": "object",
      "minProperties": 1,
      "propertyNames": {
        "$ref": "#/$defs/box-id"
      },
      "additionalProperties": {
        "$ref": "#/$defs/box"
      }
    },
    "controllers": {
      "type": "object",
      "additionalProperties": false,
      "required": [
        "active"
      ],
      "properties": {
        "active": {
          "$ref": "#/$defs/box-id"
        },
        "standby": {
          "$ref": "#/$defs/box-id"
        }
      }
    },
    "airunners": {
      "description": "Unique runner names (array order has no priority meaning): <box>-air, migration-only <box>-ops-airunner, or supported <cloud>-ops.",
      "type": "array",
      "minItems": 1,
      "uniqueItems": true,
      "items": {
        "$ref": "#/$defs/id"
      }
    },
    "apps": {
      "type": "object",
      "propertyNames": {
        "$ref": "#/$defs/app-id"
      },
      "additionalProperties": {
        "$ref": "#/$defs/app"
      }
    }
  }
}
