{
  "$schema": "https://raw.githubusercontent.com/klokast/klokast-box/aaaaaaaaaaaaaaaaaaaaaaaaaaaaaaaaaaaaaaaa/schemas/klokast-instance-v1.schema.json",
  "airunners": [
    "boxb-ops-airunner",
    "boxa-ops-airunner",
    "vultr-ops",
    "hetzner-ops"
  ],
  "apps": {
    "music": {
      "data": {
        "library": {
          "box": "boxb",
          "retention": "preserve"
        }
      },
      "desired-state": "absent"
    }
  },
  "boxes": {
    "boxa": {
      "connectivity": [
        "direct-wan-egress",
        "local-ap-uplink",
        "overlay"
      ],
      "country": "XA",
      "description": "",
      "site": "site-a",
      "routing-profile": {
        "domain-list-url": null,
        "bootstrap-dns": [
          "1.1.1.1",
          "8.8.8.8"
        ],
        "vpn-dns": [
          "https://1.1.1.1/dns-query",
          "https://8.8.8.8/dns-query"
        ]
      }
    },
    "boxb": {
      "connectivity": [
        "overlay"
      ],
      "country": "XB",
      "description": "",
      "site": "site-b",
      "routing-profile": {
        "domain-list-url": null,
        "bootstrap-dns": [
          "1.1.1.1",
          "8.8.8.8"
        ],
        "vpn-dns": [
          "https://1.1.1.1/dns-query",
          "https://8.8.8.8/dns-query"
        ]
      }
    }
  },
  "controllers": {
    "active": "boxa",
    "standby": "boxb"
  },
  "schema-version": 1,
  "tailscale": {
    "members": {
      "admin@example.com": {
        "roles": [
          "family",
          "operator"
        ]
      },
      "family@example.com": {
        "roles": [
          "family"
        ]
      }
    },
    "tailnet-dns-name": "example.ts.net"
  }
}
