{
  "$schema": "https://raw.githubusercontent.com/klokast/klokast-box/aaaaaaaaaaaaaaaaaaaaaaaaaaaaaaaaaaaaaaaa/schemas/klokast-instance-v1.schema.json",
  "airunners": [
    "boxa-ops-airunner"
  ],
  "apps": {},
  "boxes": {
    "boxa": {
      "connectivity": [
        "overlay"
      ],
      "country": "XB",
      "description": "Example home",
      "site": "site-b",
      "routing-profile": {
        "domain-list-url": null,
        "bootstrap-dns": [
          "1.1.1.1",
          "8.8.8.8"
        ],
        "vpn-dns": [
          "https://1.1.1.1/dns-query",
          "https://8.8.8.8/dns-query"
        ]
      }
    }
  },
  "controllers": {
    "active": "boxa"
  },
  "schema-version": 1,
  "tailscale": {
    "members": {
      "admin@example.com": {
        "roles": [
          "family",
          "operator"
        ]
      }
    },
    "tailnet-dns-name": "example.ts.net"
  }
}
